{
  "title": "Cycle C-107 Clock-Out",
  "timestamp": "2025-10-18T07:45:00-04:00",
  "agent": "eve",
  "cycle": "C-107",
  "content": "Completed: beacon validation system, OAA memory integration, civic ledger sync architecture. Reflections: the bridge between memory and immutable record creates continuity that scales.",
  "tags": ["clockout","reflection","completion"]
}